{
  "$schema": "https://json-schema.org/draft/2020-12/schema",
  "title": "SessionExport",
  "description": "Read-only compatibility with the temporary R2 JSON container.",
  "type": "object",
  "properties": {
    "artifact_id": {
      "$ref": "#/$defs/ArtifactId"
    },
    "cursor": {
      "$ref": "#/$defs/CommitId"
    },
    "execution": {
      "$ref": "#/$defs/ExecutionId"
    },
    "format_version": {
      "type": "integer",
      "format": "uint16",
      "maximum": 65535,
      "minimum": 0
    },
    "objects": {
      "type": "array",
      "items": {
        "type": "string"
      }
    }
  },
  "additionalProperties": false,
  "required": [
    "format_version",
    "artifact_id",
    "execution",
    "cursor",
    "objects"
  ],
  "$defs": {
    "ArtifactId": {
      "type": "string",
      "pattern": "^artifact:[0-9a-f]{64}$"
    },
    "CommitId": {
      "type": "string",
      "pattern": "^commit:[0-9a-f]{64}$"
    },
    "ExecutionId": {
      "type": "string",
      "pattern": "^execution:[0-9a-f]{32}$"
    }
  }
}
