{"artifact_id":"artifact:6fbb7fb6748fc14f95970dc301c5bf5cdd3b18d57adbddbdf1002e524618294b","cursor":"commit:2098d8d635ed853d028c1f07745412bfd5adb1a45c971ab04f38c3a8a7aa9e56","execution":"execution:0190f2a0000070008000000000000001","format_version":2,"objects":["4e415252415441000000011100010000000000000000005d7fdb05e8795b12e43bc380502de5fefd82218286fb6be08e7cf6d847ac692895a300828265636f696e7382010082646c616d708200f40181a60082646d61696e65737461727401500000000000000000000000000000000102500000000000000000000000000000000103010480058182667669736974738201000202","4e415252415441000000011000010000000000000000004de8502b299df8520462b0b3bcb7105e4240dc149b4351b00bdf1a4f181415408ba50058206fbb7fb6748fc14f95970dc301c5bf5cdd3b18d57adbddbdf1002e524618294b01f602f6035820c2b322dcb42449ac086d1c6799e5dfd34a346402afcda10c85f9e1e054b898e20400"]}
